A2: Driver Performance Report
A4: 25-Sep-09 to 30-Sep-09
A6: SlNo | B6: Driver Name | C6: Distance | D6: OverSpeed | E6: Rating
A7: 1 | B7: RAM DAS YADAV | C7: 623 | D7: 3 | E7: =D7/C7*100 -> 0.4815409309791332
A8: 2 | B8: AVATAR TYAGI | C8: 710 | D8: 2 | E8: =D8/C8*100 -> 0.28169014084507044
A9: 3 | B9: BACHAN LAL | C9: 572 | D9: 2 | E9: =D9/C9*100 -> 0.34965034965034963
A10: 4 | B10: RUPESH KHANNA | C10: 632 | D10: 4 | E10: =D10/C10*100 -> 0.63291139240506333
A11: 5 | B11: SHYAM PRASAD | C11: 596 | D11: 3 | E11: =D11/C11*100 -> 0.50335570469798652